{
  "$schema": "http://json-schema.org/draft-07/schema#",
  "title": "InductiveThought",
  "type": "object",
  "required": [
    "mode",
    "observations",
    "generalization",
    "confidence"
  ],
  "properties": {
    "mode": {
      "const": "inductive"
    },
    "observations": {
      "type": "array",
      "minItems": 1,
      "items": {
        "type": "string"
      }
    },
    "pattern": {
      "type": [
        "string",
        "null"
      ]
    },
    "generalization": {
      "type": "string",
      "minLength": 1
    },
    "confidence": {
      "type": "number",
      "minimum": 0,
      "maximum": 1
    },
    "counterexamples": {
      "type": "array",
      "items": {
        "type": "string"
      }
    },
    "sampleSize": {
      "type": [
        "integer",
        "null"
      ],
      "minimum": 1
    }
  },
  "additionalProperties": false
}